iter	timestamp	change_desc	commit	metric_total_nsop	delta	delta_pct	guard	decision	notes
0	2026-05-23T11:45	baseline (stable subset, median of 3 runs)	897f12f	2183355822	0	0.00%	skipped	baseline	74 stable benchmarks. Excludes BenchmarkDbGrowth/BenchmarkDBOpen/BenchmarkValueGCRewriteExpiredOnlyFile (high I/O variance). Variance across 3 runs: 0.3%.
1	2026-05-23T11:55	remove defer recover() from blockIterator.setIdx	80793ca	2179144513	-4211309	-0.19%	pass	keep	BenchmarkReadMerged -8.2%; BenchmarkRead -0.7%; pure subtraction (no behavioral risk on non-panic path). GPT5 vetted.
2	2026-05-23T12:05	fuse 3 allocate calls in Builder.addHelper into 1	13cd65c	2129437251	-49707262	-2.28%	pass	keep	BenchmarkBuilder/zstd_level_1 -13.1%, /encryption -7.6%, /no_compression -9.4%. Eliminates heap-escaping h.Encode() local array + 2 capacity checks per entry. GPT5 vetted.
3	2026-05-23T12:20	pre-allocate Builder.keyHashes/blockList/entryOffsets	13cd65c	2135613532	+6176281	+0.29%	(skipped - regress)	discard	GPT5 vetted caps (keyHashes 64-512k, blockList min(128,T/B), entryOffsets max(128,B/8)). Alloc counts unchanged (~73934 for no_compression). Pre-sizing didn't help - allocator already amortizes append growth and slices outgrew our caps. No measurable gain.
4	2026-05-23T12:35	replace sizeVarint loop with bits.Len64 constant-time	13cd65c	2356500738	+227063487	+10.67%	(skipped - regress)	discard	GPT5 vetted formula. BenchmarkBuilder/no_compression at 5x: iter2=53.4ms vs iter4=64.7ms (+21%). Identical inline cost (14/36) and identical alloc count, but int division by 7 + bits.Len64 is slower than the loop's 1-iteration fast path when ExpiresAt=0 (the common case). Hot-path lesson: micro-optimizations that look constant-time can lose to short loops with branch prediction.
5	2026-05-23T12:55	skip redundant first bytes.Equal in MergeIterator.Next	dbe78d2	2079138253	-50299009	-2.36%	pass	keep	BenchmarkReadMerged ~523M ns, BenchmarkRead ~350M, BenchmarkReadAndBuild ~770M. Invariant: setCurrent() makes curKey==small.key, so the loop's first equal-check is always true. Hoist the first advance, then keep checking. GPT5 vetted. Spread across 3 runs 0.4%. Cumulative vs baseline: -4.77%.
6	2026-05-23T13:15	cache EncodedSize across shouldFinishBlock & addHelper	dbe78d2	2085226934	+6088681	+0.29%	(skipped - neutral)	discard	GPT5 vetted refactor. BenchmarkBuilder/no_compression median: iter5=55.98ms, iter6=55.05ms (-1.7%, in noise). Aggregate 2,079M -> 2,085M (+0.29%, in noise). EncodedSize already heavily inlined; sizeVarint is 1-iter loop for ExpiresAt=0 (common). No measurable gain; reverted to avoid adding complexity (wrapper function + new helper) without benefit.
7	2026-05-23T13:35	finishBlock: PutUint32 directly into b.allocate(4) (skip U32ToBytes)	dbe78d2	2090563965	+11425712	+0.55%	(skipped - neutral)	discard	GPT5 vetted. y.U32ToBytes' uBuf reports "escapes to heap" via -gcflags=-m, but post-inline escape analysis already eliminated it - alloc count unchanged (162,596 vs 162,598). Net no measurable gain. Lesson: trust benchmark allocs/op over -m output; inliner often elides apparent escapes.
8	2026-05-23T14:05	setIdx: uint(i)>=uint(n) bounds check + cache len + direct LE Uint32 header decode	dbe78d2	2079893736	+755483	+0.04%	(skipped - neutral)	discard	GPT5 vetted all 4 sub-changes. Median of 3 runs (2079M, 2070M, 2102M). Per-bench: Read 344M vs ~350M (-1.7%, in noise), ReadAndBuild 761M vs ~770M (-1.2%, in noise), ReadMerged 525M vs ~523M (+0.4%, in noise). Compiler already optimal here: copy([4]byte) lowered to single 4-byte load; two-condition bounds check predicted well. No measurable win.
